id,title,description,link,image_link,price,availability,condition,google_product_category,gtin,brand,age_group,gender,shipping_country,shipping_service,shipping_price
sentinel-s-infantil,Reloj GPS Sentinel S - Niños,Reloj GPS para niños con botón SOS y localización en tiempo real,https://manoprotectt.com/sentinel-s,https://images.unsplash.com/photo-1523275335684-37898b6baf30?w=800,39.99 EUR,in_stock,new,Electronics > Computers > Wearables,5901234123457,ManoProtect,kids,unisex,ES,Envio Standard,0 EUR
sentinel-s-senior-mensual,Reloj GPS Sentinel S - Mayores Mensual,Reloj GPS para personas mayores con detector de caidas y monitorización 24/7,https://manoprotectt.com/sentinel-s,https://images.unsplash.com/photo-1523275335684-37898b6baf30?w=800,49.99 EUR,in_stock,new,Electronics > Computers > Wearables,5901234123458,ManoProtect,adults,unisex,ES,Envio Standard,0 EUR
sentinel-s-senior-anual,Reloj GPS Sentinel S - Mayores Anual,Reloj GPS para personas mayores con suscripcion anual,https://manoprotectt.com/sentinel-s,https://images.unsplash.com/photo-1523275335684-37898b6baf30?w=800,499.99 EUR,in_stock,new,Electronics > Computers > Wearables,5901234123459,ManoProtect,adults,unisex,ES,Envio Standard,0 EUR
sentinel-x-adultos-mensual,Reloj GPS Sentinel X - Adultos Mensual,Reloj GPS premium para adultos con sensor cardiaco y monitorización 24/7,https://manoprotectt.com/sentinel-x,https://images.unsplash.com/photo-1579586337278-3befd40fd17c?w=800,69.99 EUR,in_stock,new,Electronics > Computers > Wearables,5901234123460,ManoProtect,adults,unisex,ES,Envio Standard,0 EUR
sentinel-x-adultos-anual,Reloj GPS Sentinel X - Adultos Anual,Reloj GPS premium para adultos con suscripcion anual,https://manoprotectt.com/sentinel-x,https://images.unsplash.com/photo-1579586337278-3befd40fd17c?w=800,699.99 EUR,in_stock,new,Electronics > Computers > Wearables,5901234123461,ManoProtect,adults,unisex,ES,Envio Standard,0 EUR
sentinel-j-jovenes,Reloj GPS Sentinel J - Jovenes,Reloj GPS para jovenes con botón SOS y alertas de emergencia,https://manoprotectt.com/sentinel-j,https://images.unsplash.com/photo-1523275335684-37898b6baf30?w=800,44.99 EUR,in_stock,new,Electronics > Computers > Wearables,5901234123462,ManoProtect,kids,unisex,ES,Envio Standard,0 EUR
alarma-hogar,Sistema de Alarma Hogar - Instalacion Incluida,Sistema de alarma profesional para viviendas con sensores inteligentes,https://manoprotectt.com/alarmas,https://images.unsplash.com/photo-1558618666-fcd25c85cd64?w=800,299.99 EUR,in_stock,new,Home > Security,5901234123463,ManoProtect,unisex,unisex,ES,Envio e Instalacion,0 EUR
alarma-negocio,Sistema de Alarma Negocio - Instalacion Incluida,Sistema de alarma profesional para negocios con sensores avanzados,https://manoprotectt.com/alarmas,https://images.unsplash.com/photo-1558618666-fcd25c85cd64?w=800,499.99 EUR,in_stock,new,Business > Security,5901234123464,ManoProtect,unisex,unisex,ES,Envio e Instalacion,0 EUR
